{"data": {"domain": "www.acrodesk.com", "dates": {"created": "2018-09-28", "expires": "2025-09-28", "updated": "2024-09-28", "age_days": 2538}, "registrar": {"name": "INWX GmbH", "iana_id": "", "url": ""}, "name_servers": ["ns3.inwx.eu", "ns.inwx.de", "ns2.inwx.de"], "status": ["clienttransferprohibited https://icann.org/epp#clienttransferprohibited"], "contacts": {"registrant": {}, "admin": {}, "tech": {}}, "security": {"dnssec": "unsigned", "privacy_proxy": true, "privacy_service": "Redacted for Privacy", "abuse_contact": "", "suspicious_keywords": [], "expiry_status": ""}, "raw": "   Domain Name: ACRODESK.COM\r\n   Registry Domain ID: 2315207696_DOMAIN_COM-VRSN\r\n   Registrar WHOIS Server: whois.domrobot.com\r\n   Registrar URL: http://www.inwx.com\r\n   Updated Date: 2024-09-29T07:07:58Z\r\n   Creation Date: 2018-09-28T07:48:39Z\r\n   Registry Expiry Date: 2025-09-28T07:48:39Z\r\n   Registrar: INWX GmbH\r\n   Registrar IANA ID: 1420\r\n   Registrar Abuse Contact Email: abuse@inwx.com\r\n   Registrar Abuse Contact Phone: +49.30983212123\r\n   Domain Status: clientTransferProhibited https://icann.org/epp#clientTransferProhibited\r\n   Name Server: NS.INWX.DE\r\n   Name Server: NS2.INWX.DE\r\n   Name Server: NS3.INWX.EU\r\n   DNSSEC: unsigned\r\n   URL of the ICANN Whois Inaccuracy Complaint Form: https://www.icann.org/wicf/\r\n>>> Last update of whois database: 2025-09-08T23:57:15Z <<<\r\n\r\nFor more information on Whois status codes, please visit https://icann.org/epp\r\n\r\nNOTICE: The expiration date displayed in this record is the date the\r\nregistrar's sponsorship of the domain name registration in the registry is\r\ncurrently set to expire. This date does not necessarily reflect the expiration\r\ndate of the domain name registrant's agreement with the sponsoring\r\nregistrar.  Users may consult the sponsoring registrar's Whois database to\r\nview the registrar's reported date of expiration for this registration.\r\n\r\nTERMS OF USE: You are not authorized to access or query our Whois\r\ndatabase through the use of electronic processes that are high-volume and\r\nautomated except as reasonably necessary to register domain names or\r\nmodify existing registrations; the Data in VeriSign Global Registry\r\nServices' (\"VeriSign\") Whois database is provided by VeriSign for\r\ninformation purposes only, and to assist persons in obtaining information\r\nabout or related to a domain name registration record. VeriSign does not\r\nguarantee its accuracy. By submitting a Whois query, you agree to abide\r\nby the following terms of use: You agree that you may use this Data only\r\nfor lawful purposes and that under no circumstances will you use this Data\r\nto: (1) allow, enable, or otherwise support the transmission of mass\r\nunsolicited, commercial advertising or solicitations via e-mail, telephone,\r\nor facsimile; or (2) enable high volume, automated, electronic processes\r\nthat apply to VeriSign (or its computer systems). The compilation,\r\nrepackaging, dissemination or other use of this Data is expressly\r\nprohibited without the prior written consent of VeriSign. You agree not to\r\nuse electronic processes that are automated and high-volume to access or\r\nquery the Whois database except as reasonably necessary to register\r\ndomain names or modify existing registrations. VeriSign reserves the right\r\nto restrict your access to the Whois database in its sole discretion to ensure\r\noperational stability.  VeriSign may restrict or terminate your access to the\r\nWhois database for failure to abide by these terms of use. VeriSign\r\nreserves the right to modify these terms at any time.\r\n\r\nThe Registry database contains ONLY .COM, .NET, .EDU domains and\r\nRegistrars.\r\nDomain Name: acrodesk.com\nRegistry Domain ID: 2315207696_DOMAIN_COM-VRSN\nRegistrar WHOIS Server: whois.domrobot.com\nRegistrar URL: https://whois.domrobot.com\nUpdated Date: 2024-09-28T00:20:06Z\nCreation Date: 2018-09-28T07:48:39Z\nRegistrar Registration Expiration Date: 2025-09-28T07:48:39Z\nRegistrar: INWX GmbH\nRegistrar IANA ID: 1420\nRegistrar Abuse Contact Email: abuse@domrobot.com\nRegistrar Abuse Contact Phone: +49.30983212112\nReseller: INWX GmbH\nReseller URL: https://www.inwx.de\nDomain Status: clientTransferProhibited https://icann.org/epp#clientTransferProhibited\nRegistry Registrant ID: REDACTED FOR PRIVACY\nRegistrant Name: REDACTED FOR PRIVACY\nRegistrant Organization: REDACTED FOR PRIVACY\nRegistrant Street: REDACTED FOR PRIVACY\nRegistrant City: REDACTED FOR PRIVACY\nRegistrant State/Province: \nRegistrant Postal Code: REDACTED FOR PRIVACY\nRegistrant Country: DE\nRegistrant Phone: REDACTED FOR PRIVACY\nRegistrant Phone Ext: REDACTED FOR PRIVACY\nRegistrant Fax: REDACTED FOR PRIVACY\nRegistrant Fax Ext: REDACTED FOR PRIVACY\nRegistrant Email: REDACTED FOR PRIVACY\nRegistry Admin ID: REDACTED FOR PRIVACY\nAdmin Name: REDACTED FOR PRIVACY\nAdmin Organization: REDACTED FOR PRIVACY\nAdmin Street: REDACTED FOR PRIVACY\nAdmin City: REDACTED FOR PRIVACY\nAdmin State/Province: REDACTED FOR PRIVACY\nAdmin Postal Code: REDACTED FOR PRIVACY\nAdmin Country: REDACTED FOR PRIVACY\nAdmin Phone: REDACTED FOR PRIVACY\nAdmin Phone Ext: REDACTED FOR PRIVACY\nAdmin Fax: REDACTED FOR PRIVACY\nAdmin Fax Ext: REDACTED FOR PRIVACY\nAdmin Email: REDACTED FOR PRIVACY\nRegistry Tech ID: REDACTED FOR PRIVACY\nTech Name: REDACTED FOR PRIVACY\nTech Organization: REDACTED FOR PRIVACY\nTech Street: REDACTED FOR PRIVACY\nTech City: REDACTED FOR PRIVACY\nTech State/Province: REDACTED FOR PRIVACY\nTech Postal Code: REDACTED FOR PRIVACY\nTech Country: REDACTED FOR PRIVACY\nTech Phone: REDACTED FOR PRIVACY\nTech Phone Ext: REDACTED FOR PRIVACY\nTech Fax: REDACTED FOR PRIVACY\nTech Fax Ext: REDACTED FOR PRIVACY\nTech Email: REDACTED FOR PRIVACY\nRegistry Billing ID: REDACTED FOR PRIVACY\nBilling Name: REDACTED FOR PRIVACY\nBilling Organization: REDACTED FOR PRIVACY\nBilling Street: REDACTED FOR PRIVACY\nBilling City: REDACTED FOR PRIVACY\nBilling State/Province: REDACTED FOR PRIVACY\nBilling Postal Code: REDACTED FOR PRIVACY\nBilling Country: REDACTED FOR PRIVACY\nBilling Phone: REDACTED FOR PRIVACY\nBilling Phone Ext: REDACTED FOR PRIVACY\nBilling Fax: REDACTED FOR PRIVACY\nBilling Fax Ext: REDACTED FOR PRIVACY\nBilling Email: REDACTED FOR PRIVACY\nName Server: ns.inwx.de\nName Server: ns2.inwx.de\nName Server: ns3.inwx.eu\nDNSSEC: unsigned\nURL of the ICANN WHOIS Data Problem Reporting System: https://wdprs.internic.net/\n>>> Last update of WHOIS database: 2025-09-08T23:57:25Z <<<\n\nFor more information on Whois status codes, please visit https://icann.org/epp\n\nTerms of Use: This data is provided by INWX GmbH\nfor information purposes, and to assist persons obtaining information\nabout or related to domain name registration records.\nINWX GmbH does not guarantee its accuracy.\nBy submitting a WHOIS query, you agree that you will use this data\nonly for lawful purposes and that, under no circumstances, you will\nuse this data to\n1) allow, enable, or otherwise support the transmission of mass\nunsolicited, commercial advertising or solicitations via E-mail\n(spam); or\n2) enable high volume, automated, electronic processes that apply\nto this WHOIS server.\nThese terms may be changed without prior notice.\nBy submitting this query, you agree to abide by this policy.\n\nYou can use the following website to send a message to contacts of a domain: https://whois-contact.domrobot.com\n", "metrics": {"expiry_days": 18, "update_recency": 346}, "tld": "com", "scan_type": "WHOIS Lookup", "timestamp": "2025-09-09 04:57:20"}, "expiry": 1757462243.9883747, "created": 1757375843.9883747}